{
  "world_id": "world",
  "state_id": 14,
  "province_id": "prov_14_outer_atolls",
  "checksum": "fnv1a_4d71bae3",
  "name": "Outer Atolls",
  "aliases": [
    "Atoll Fringe",
    "Outer Rings"
  ],
  "tags": [
    "coastal",
    "atoll",
    "pilot-chain",
    "saltworks"
  ],
  "role_in_state": "maritime hazard buffer and pilot-outpost chain",
  "economy_niches": [
    "nearshore fishing & reef gleaning",
    "smallâ€‘craft shipbuilding & repair",
    "saltworks & fish-drying vats",
    "piloting & augury-services",
    "pearling and sponge diving"
  ],
  "culture_adjustments": [
    "boat-centric kinship; many households semimobile",
    "intense secrecy around local pilot-charts and routes",
    "sea-rituals keyed to reef and tide cycles; stronger animist practice",
    "greater contact with island creole traders; lexical and ritual blending"
  ],
  "religion_profile": {
    "families_present": [
      "Sea-Tide Animisms",
      "Merchant Brotherhood Liturgies",
      "Ancestor-Remembrance Cults"
    ],
    "dominant": "Sea-Tide Animisms"
  },
  "settlements_hint": [],
  "risks": [
    "cyclones and storm surge",
    "reef-grounding and wreckage",
    "supply isolation/drydock shortages",
    "fisheries collapse/coral disease",
    "piracy on coastal lanes"
  ],
  "constraints": [
    "scarce freshwater and arable land",
    "ritual reagents costly; augury services limited by imports",
    "no capacity for heavy industrial shipyards"
  ],
  "notes": [
    "serves as first warning chain for storms and enemy approach",
    "high apprenticeship rates in piloting and augury guilds",
    "distinct local pilot-chart variants prized by mainland captains"
  ],
  "generated_at": "2025-09-09T04:04:30.928Z"
}