{
  "world_id": "world",
  "state_id": 5,
  "province_id": "prov_5_glassharbor",
  "checksum": "fnv1a_30ce07db",
  "name": "Glassharbor",
  "aliases": [
    "Glass Harbor",
    "Glasharbor"
  ],
  "tags": [
    "coastal",
    "port",
    "glassmaking",
    "shipbuilding",
    "augury"
  ],
  "role_in_state": "specialist port for glassware, auguries and ship repair",
  "economy_niches": [
    "lens & crystal manufacture for navigational auguries",
    "glass-encased reagent production & trade",
    "guild-run shipbuilding & repair",
    "saltworks & fisheries support",
    "navigational-augury calibration services"
  ],
  "culture_adjustments": [
    "stronger guild monopoly over craft and trade",
    "harbor-kin clans dominate apprenticeships and crew assignments",
    "practical ritualism centered on instrument-making",
    "stricter pilot hospitality protocols and vetting"
  ],
  "religion_profile": {
    "families_present": [
      "Sea-Tide Animisms",
      "Merchant Brotherhood Liturgies",
      "Ancestor-Remembrance Cults"
    ],
    "dominant": "Sea-Tide Animisms"
  },
  "settlements_hint": [],
  "risks": [
    "storm-surge",
    "factory-fire",
    "reagent-shortage",
    "piracy"
  ],
  "constraints": [
    "guild monopoly limits independent craftsmen",
    "glass furnaces constrained by imported fuel/reagent quotas",
    "ritual consumables scarce and tightly controlled"
  ],
  "notes": [
    "regional centre for navigational lenses and augury spheres",
    "kiln-works built into coastal cliffs to shield from storms"
  ],
  "generated_at": "2025-09-09T05:07:03.106Z"
}